{
  "$schema": "https://json-schema.org/draft/2020-12/schema",
  "$id": "https://harness-platform.local/schemas/company_config.schema.json",
  "title": "CompanyConfig",
  "description": "Legacy due-diligence engagement shape. Prefer instance_config.schema.json for new integrations.",
  "type": "object",
  "required": ["target_company", "workflow_template_id", "resources"],
  "properties": {
    "target_company": {
      "type": "object",
      "required": ["name"],
      "properties": {
        "name": { "type": "string", "minLength": 1 },
        "aliases": { "type": "array", "items": { "type": "string" }, "default": [] }
      }
    },
    "workflow_template_id": {
      "type": "string",
      "description": "Published workflow template id used by downstream runs."
    },
    "workflow_template_version": {
      "type": "integer",
      "description": "Published workflow template version selected for this engagement."
    },
    "resources": {
      "type": "object",
      "properties": {
        "uploaded_files": { "type": "array", "items": { "type": "string" }, "default": [] },
        "trusted_sources": { "type": "array", "items": { "type": "string" }, "default": [] },
        "blocked_sources": { "type": "array", "items": { "type": "string" }, "default": [] },
        "competitors": { "type": "array", "items": { "type": "string" }, "default": [] }
      }
    }
  }
}
