{
  "target_company": {
    "name": "Example Robotics",
    "aliases": ["ExampleBot"]
  },
  "workflow_template_id": "standard_due_diligence",
  "workflow_template_version": 1,
  "resources": {
    "uploaded_files": [],
    "trusted_sources": ["公司官网", "交易所公告", "工商登记信息"],
    "blocked_sources": [],
    "competitors": ["Peer Robotics", "Warehouse AI"]
  }
}
